words,example
élucubration,"je dois avouer que nos communes élucubrations demandent un tout autre travail concomitant qu'il n'est pas toujours facile de maintenir (d'où l'intérêt de notre collaboration !)."
élégie,"Votre démonstration élégiaque est fuligineuse, vous savez ?"
épigramme,"Titeuf qui n'a pas la plume particulièrement littéraire, et donc peu enclin à rédiger des épigrammes élégiaques ou anacréontiques, voire ossianiques, lui propose plutôt, rimbou et avec un ton relou : ""Eh Nadia, tu viens faire un tour dans ma décapotable rouge… couleur Ferrari ?!""  (cf. Histoires)"
éponyme,"Seriez-vous un Schtroumpf éponyme ?"
éructer,"Mr Millon, vous avez éructé quelque chose ?"
éructer|néphrétique,"Vous éructez des borborygmes néphrétiques."
étiologie,"Un petit exemple étiologique ?"
étrusque,"Je parle l'Étrusque ancien, M. Bacconnier ?"